{
  "version": "1.0",
  "itemName": "RadioGroup",
  "itemType": "iic",
  "paramIdScore0001": {
    "content": "",
    "ref": "",
    "scene": "scene1"
  },
  "paramId0001": {
    "content": "RadioGroup",
    "ref": "",
    "scene": "scene1"
  },
  "paramId0002": {
    "content": "RadioResponse",
    "ref": "",
    "scene": "scene1"
  },
  "paramId0003": {
    "content": [
      {
        "label": "option 1",
        "value": "1",
        "optionLabel": null,
        "selected": "false"
      },
      {
        "label": "option 2",
        "value": "2",
        "optionLabel": null,
        "selected": "false"
      },
      {
        "label": "option 3",
        "value": "3",
        "optionLabel": null,
        "selected": "false"
      },
      {
        "label": "option 4",
        "value": "4",
        "optionLabel": null,
        "selected": "false"
      },
      {
        "label": "option 5",
        "value": "5",
        "optionLabel": null,
        "selected": "false"
      }
    ],
    "ref": "",
    "scene": "scene1"
  }
}
